{
  "id": "11111111-1111-4111-8111-111111111111",
  "schema_version": "0.1.0",
  "revision": 1,
  "created_at": "2026-10-20T09:00:00Z",
  "updated_at": "2026-10-20T09:00:00Z",
  "kind": "note",
  "title": "Synthetic note — приклад 🧠",
  "body": "# Example\n\nFabricated knowledge for contract tests only.\n",
  "lifecycle": "draft",
  "sensitivity": "internal",
  "provenance_refs": [],
  "relations": [],
  "topics": ["contract-testing"]
}
